{
  "authorities": {
    "claims": {
      "path": "articles/proximal_distal_energy_transfer/data/claim_adjudication_summary.json",
      "sha256": "21cd105216d53adb7706f1e21a7be5e0d37c0e2d061b3843fb17fd18fdfeb33a"
    },
    "critiques": {
      "path": "data/trust/claim_critique_ledger.json",
      "sha256": "36ba7df91e13e59537fce3de24145edb655be26bd6718095c05854e97acfaeff"
    },
    "readiness": {
      "path": "data/research_protocols/library.json",
      "sha256": "2f42f3ec7961f8346f65ee0d6018301a9383b44afc2186c0267116b8bb1447b8"
    },
    "source_manifest": {
      "path": "articles/proximal_distal_energy_transfer/source_manifest.json",
      "sha256": "c89f7011cc78057ae6d5e9ea5d5d8ddafd22d08d0c3c5c3a972c4ccaa71e86a1"
    }
  },
  "provider_authority": {
    "reason": "This atlas has no registered qualified companion workflow artifact. The imported monograph claim snapshot and linked readiness records are separate evidence sources; consult the provider issue for later publication progress.",
    "state": "unavailable",
    "tracking_issue": "https://github.com/D-sorganization/UpstreamDrift/issues/9174"
  },
  "records": [
    {
      "alternative_mechanism": "Different admissible command and contact histories can produce the same selected endpoint observable. Matching speed alone does not match the full terminal state or internal history.",
      "atlas_id": "pd-atlas-endpoint-equifinality",
      "chapter_anchor": "sec-ladder-strategy",
      "chapter_path": "articles/proximal_distal_energy_transfer/chapters/_ch07_model_ladder.qmd",
      "claim_id": "PD-CLAIM-131",
      "critique_id": "crit-simulation-tautology",
      "critique_question": "Does selecting only endpoint speed make distinct internal mechanisms appear equivalent by construction?",
      "discriminating_measurement": "Declare the endpoint map, event and matching tolerance; compare full state, work, loads, constraints and robustness among matched outcomes. Separately test model interventions from the same complete dynamical state.",
      "readiness_protocol_id": "ad-protocol-model-ladder-001",
      "theme": "endpoint-equifinality",
      "title": "Similar Endpoints Can Hide Different Internal Pathways",
      "workflow": {
        "provider_record_url": null,
        "reason": "No qualified provider workflow record is registered for this atlas card. This is a limitation of the atlas registration, not a claim that no software or measurements exist elsewhere.",
        "state": "unavailable"
      }
    },
    {
      "alternative_mechanism": "Continuing a specified command channel can change both timing and the delivery objective. That conditional intervention effect does not identify a universal benefit of the observed sequence.",
      "atlas_id": "pd-atlas-timing-without-benefit",
      "chapter_anchor": "sec-shoulder-velocity-transfer",
      "chapter_path": "articles/proximal_distal_energy_transfer/chapters/_ch03d_shoulder_velocity_transfer.qmd",
      "claim_id": "PD-CLAIM-237",
      "critique_id": "crit-sequencing-lie-bracket-fallacy",
      "critique_question": "Is an observed timing change being treated as beneficial without a matched objective and intervention?",
      "discriminating_measurement": "Branch the registered model at the same event and complete state, including any activation or compliance states. Declare the command-removal operation, other command histories or feedback policies, endpoint rule and uncertainty; compare objective, work and loads together.",
      "readiness_protocol_id": "ad-protocol-neural-timing-001",
      "theme": "timing-without-benefit",
      "title": "A Timing Change Is Not Automatically Beneficial Transfer",
      "workflow": {
        "provider_record_url": null,
        "reason": "No qualified provider workflow record is registered for this atlas card. This is a limitation of the atlas registration, not a claim that no software or measurements exist elsewhere.",
        "state": "unavailable"
      }
    },
    {
      "alternative_mechanism": "Coordinate partitions and unweighted least-squares metrics can change attributed components and the fitted force. The reconstructed generalized drive includes the retained residual; a force-only fit need not identify the complete physical wrench.",
      "atlas_id": "pd-atlas-coordinate-dependent-attribution",
      "chapter_anchor": "sec-source-hand-path-map",
      "chapter_path": "articles/proximal_distal_energy_transfer/chapters/_ch03ba_coordinate_force_sources.qmd",
      "claim_id": "PD-CLAIM-306",
      "critique_id": "crit-control-causality-mechanical",
      "critique_question": "Does a named generalized component survive a change of coordinates and physical endpoint representation?",
      "discriminating_measurement": "Transform the same physical trajectory, generalized covectors, Jacobian and residual metric consistently. Check total virtual power and reconstruction in one observer frame; report rank, residual and fitted-force sensitivity separately. Do not demand invariance of arbitrary component allocations.",
      "readiness_protocol_id": "ad-protocol-model-ladder-001",
      "theme": "coordinate-dependent-attribution",
      "title": "Attribution Depends on Coordinates and Endpoint Mapping",
      "workflow": {
        "provider_record_url": null,
        "reason": "No qualified provider workflow record is registered for this atlas card. This is a limitation of the atlas registration, not a claim that no software or measurements exist elsewhere.",
        "state": "unavailable"
      }
    },
    {
      "alternative_mechanism": "Equal-and-opposite force increments preserve resultant force but generally change its moment. Increments along the line joining ideal point contacts can preserve the complete wrench while changing individual contact loads, subject to admissibility constraints.",
      "atlas_id": "pd-atlas-bilateral-hand-ambiguity",
      "chapter_anchor": "sec-attribution-two-hand-modes",
      "chapter_path": "articles/proximal_distal_energy_transfer/chapters/_ch03b_hand_path_attribution.qmd",
      "claim_id": "PD-CLAIM-068",
      "critique_id": "crit-ztcf-identifiability",
      "critique_question": "Is a net club wrench being used to infer individual-hand loading, effort, or muscle coordination?",
      "discriminating_measurement": "Express synchronized bilateral force-and-moment measurements about one reference point and frame, with calibration and uncertainty. Check net-wrench closure and admissible nullspace changes. These measurements constrain contact allocation, not unique muscle effort or co-contraction.",
      "readiness_protocol_id": "ad-protocol-bilateral-hand-wrench-001",
      "theme": "bilateral-hand-ambiguity",
      "title": "One Net Club Wrench Does Not Identify Two Hand Loads",
      "workflow": {
        "provider_record_url": null,
        "reason": "No qualified provider workflow record is registered for this atlas card. This is a limitation of the atlas registration, not a claim that no software or measurements exist elsewhere.",
        "state": "unavailable"
      }
    },
    {
      "alternative_mechanism": "A fixed ideal support can exchange momentum while doing zero work at its stationary contact. A prescribed moving base can supply or remove mechanical energy. A finite-mass dynamic base changes the coupled response; none of these facts alone disproves a late negative couple.",
      "atlas_id": "pd-atlas-prescribed-base-artifacts",
      "chapter_anchor": "sec-coupled-interpretation",
      "chapter_path": "articles/proximal_distal_energy_transfer/chapters/_ch06b_coupled_base_flex.qmd",
      "claim_id": "PD-CLAIM-159",
      "critique_id": "crit-effective-plant-fallacy",
      "critique_question": "Would the apparent mechanism persist when base motion is endogenous rather than prescribed or fixed?",
      "discriminating_measurement": "Map compatible physical initial states and event rules across fixed, prescribed and dynamic-base models. Include support reactions and prescribed-base power in the chosen system boundary; test sign, reconstruction, convergence and geometry controls without treating unlike models as the same experiment.",
      "readiness_protocol_id": "ad-protocol-model-ladder-001",
      "theme": "prescribed-base-artifacts",
      "title": "Base Constraints Change the Modeled Coupling",
      "workflow": {
        "provider_record_url": null,
        "reason": "No qualified provider workflow record is registered for this atlas card. This is a limitation of the atlas registration, not a claim that no software or measurements exist elsewhere.",
        "state": "unavailable"
      }
    },
    {
      "alternative_mechanism": "Shaft deformation stores energy, but the sign and timing of its release, damping, contact and continuing actuation determine delivery. Equal peak deformation does not specify endpoint speed or an energetic benefit.",
      "atlas_id": "pd-atlas-shaft-contact-confounding",
      "chapter_anchor": "sec-shaft-strategy",
      "chapter_path": "articles/proximal_distal_energy_transfer/chapters/_ch06_shaft_contributions.qmd",
      "claim_id": "PD-CLAIM-144",
      "critique_id": "crit-stiffness-pulse-paradox",
      "critique_question": "Is peak shaft strain being credited as beneficial recoil without matching actuation, damping, contact, and endpoint?",
      "discriminating_measurement": "Declare either a fixed-command comparison of endpoint outcomes or a matched-delivery comparison of required inputs and losses. Keep the endpoint definition and event rule fixed, account for changed inertia and contact, and measure deformation and boundary power. Do not silently impose both identical commands and identical outcomes.",
      "readiness_protocol_id": "ad-protocol-equipment-response-001",
      "theme": "shaft-contact-confounding",
      "title": "Shaft Recoil, Actuation, Damping, and Contact Are Confounded",
      "workflow": {